{
  "$schema": "https://json-schema.org/draft/2020-12/schema",
  "title": "EmbodiChain static architecture snapshot (v1 proposal)",
  "description": "Reviewable snapshot contract; not an executable Task Program or runtime trace. Graph integrity and source evidence require checks beyond JSON Schema.",
  "type": "object",
  "additionalProperties": false,
  "required": [
    "schema_version",
    "kind",
    "coverage",
    "repository",
    "revision",
    "source_ref",
    "package_version",
    "topic_index",
    "limitations",
    "nodes",
    "edges",
    "views"
  ],
  "properties": {
    "schema_version": {
      "const": 1
    },
    "kind": {
      "const": "static-architecture"
    },
    "coverage": {
      "enum": [
        "curated-sample",
        "curated-release"
      ]
    },
    "repository": {
      "const": "DexForce/EmbodiChain"
    },
    "revision": {
      "type": "string",
      "pattern": "^[0-9a-f]{40}$"
    },
    "source_ref": {
      "type": "string",
      "minLength": 1
    },
    "package_version": {
      "type": "string",
      "minLength": 1
    },
    "topic_index": {
      "const": "agent_context/MAP.yaml"
    },
    "limitations": {
      "type": "array",
      "items": {
        "type": "string",
        "minLength": 1
      },
      "minItems": 1
    },
    "nodes": {
      "type": "array",
      "items": {
        "$ref": "#/$defs/node"
      },
      "minItems": 1
    },
    "edges": {
      "type": "array",
      "items": {
        "$ref": "#/$defs/edge"
      },
      "minItems": 0
    },
    "views": {
      "type": "array",
      "items": {
        "$ref": "#/$defs/view"
      },
      "minItems": 1
    }
  },
  "$defs": {
    "evidence": {
      "type": "object",
      "additionalProperties": false,
      "required": [
        "path",
        "symbol",
        "start_line",
        "end_line",
        "excerpt"
      ],
      "properties": {
        "path": {
          "type": "string",
          "pattern": "^(?!/)(?!.*(?:^|/)\\.{1,2}(?:/|$))[A-Za-z0-9_./-]+$"
        },
        "symbol": {
          "type": "string",
          "minLength": 1
        },
        "start_line": {
          "type": "integer",
          "minimum": 1
        },
        "end_line": {
          "type": "integer",
          "minimum": 1
        },
        "excerpt": {
          "type": "string",
          "minLength": 1
        }
      }
    },
    "documentation": {
      "type": "object",
      "additionalProperties": false,
      "required": [
        "docname",
        "label"
      ],
      "properties": {
        "docname": {
          "type": "string",
          "pattern": "^(?!/)(?!.*(?:^|/)\\.{1,2}(?:/|$))[A-Za-z0-9_./-]+$"
        },
        "label": {
          "type": "string",
          "minLength": 1
        },
        "source_extension": {
          "enum": [
            ".md",
            ".rst"
          ]
        }
      }
    },
    "node": {
      "type": "object",
      "additionalProperties": false,
      "required": [
        "id",
        "label",
        "kind",
        "topic_ids",
        "summary",
        "boundaries",
        "evidence",
        "documentation"
      ],
      "properties": {
        "id": {
          "type": "string",
          "pattern": "^[a-z][a-z0-9-]*$"
        },
        "label": {
          "type": "string",
          "minLength": 1
        },
        "kind": {
          "enum": [
            "package",
            "module",
            "class",
            "function",
            "configuration"
          ]
        },
        "topic_ids": {
          "type": "array",
          "items": {
            "type": "string",
            "pattern": "^[a-z][a-z0-9-]*$"
          },
          "minItems": 0,
          "uniqueItems": true
        },
        "summary": {
          "type": "string",
          "minLength": 1
        },
        "boundaries": {
          "type": "array",
          "items": {
            "type": "string",
            "minLength": 1
          },
          "minItems": 1
        },
        "evidence": {
          "type": "array",
          "items": {
            "$ref": "#/$defs/evidence"
          },
          "minItems": 1
        },
        "documentation": {
          "type": "array",
          "items": {
            "$ref": "#/$defs/documentation"
          },
          "minItems": 0
        },
        "details": {
          "type": "string",
          "minLength": 1
        }
      }
    },
    "edge": {
      "type": "object",
      "additionalProperties": false,
      "required": [
        "id",
        "source",
        "target",
        "relation",
        "description",
        "provenance",
        "scope",
        "evidence"
      ],
      "properties": {
        "id": {
          "type": "string",
          "pattern": "^[a-z][a-z0-9-]*$"
        },
        "source": {
          "type": "string",
          "pattern": "^[a-z][a-z0-9-]*$"
        },
        "target": {
          "type": "string",
          "pattern": "^[a-z][a-z0-9-]*$"
        },
        "relation": {
          "enum": [
            "imports",
            "inherits",
            "constructs",
            "holds",
            "calls",
            "reads",
            "writes",
            "produces",
            "configures",
            "implements"
          ]
        },
        "description": {
          "type": "string",
          "minLength": 1
        },
        "provenance": {
          "enum": [
            "source-reviewed",
            "static-extracted"
          ]
        },
        "scope": {
          "type": "string",
          "minLength": 1
        },
        "evidence": {
          "type": "array",
          "items": {
            "$ref": "#/$defs/evidence"
          },
          "minItems": 1
        }
      }
    },
    "view": {
      "type": "object",
      "additionalProperties": false,
      "required": [
        "id",
        "label",
        "description",
        "node_ids",
        "edge_ids",
        "groups"
      ],
      "properties": {
        "id": {
          "type": "string",
          "pattern": "^[a-z][a-z0-9-]*$"
        },
        "label": {
          "type": "string",
          "minLength": 1
        },
        "description": {
          "type": "string",
          "minLength": 1
        },
        "node_ids": {
          "type": "array",
          "items": {
            "type": "string",
            "pattern": "^[a-z][a-z0-9-]*$"
          },
          "minItems": 1,
          "uniqueItems": true
        },
        "edge_ids": {
          "type": "array",
          "items": {
            "type": "string",
            "pattern": "^[a-z][a-z0-9-]*$"
          },
          "minItems": 0,
          "uniqueItems": true
        },
        "groups": {
          "type": "array",
          "items": {
            "$ref": "#/$defs/group"
          },
          "minItems": 1
        }
      }
    },
    "group": {
      "type": "object",
      "additionalProperties": false,
      "required": [
        "id",
        "label",
        "node_ids"
      ],
      "properties": {
        "id": {
          "type": "string",
          "pattern": "^[a-z][a-z0-9-]*$"
        },
        "label": {
          "type": "string",
          "minLength": 1
        },
        "node_ids": {
          "type": "array",
          "items": {
            "type": "string",
            "pattern": "^[a-z][a-z0-9-]*$"
          },
          "minItems": 1,
          "uniqueItems": true
        }
      }
    }
  }
}
