{
  "schema_version": 1,
  "kind": "static-architecture",
  "coverage": "curated-sample",
  "repository": "DexForce/EmbodiChain",
  "revision": "3224ac1ee28b6730b245d5cb69dc25a8d2d8dd94",
  "source_ref": "main",
  "package_version": "0.2.4",
  "topic_index": "agent_context/MAP.yaml",
  "limitations": [
    "A curated source snapshot, not a complete import graph, runtime trace, or execution order.",
    "The sequential Gym integration is emphasized. Parallel execution, recovery, validators, recording, and planner internals are not exhaustively modeled.",
    "References through protocols and injected factories are scoped to the described production assembly.",
    "Source-reviewed means checked against the pinned source revision; it is not a physical qualification result."
  ],
  "nodes": [
    {
      "id": "task-program-config",
      "label": "TaskProgramCfg",
      "kind": "class",
      "topic_ids": [
        "task-programs"
      ],
      "summary": "Strict declarative input for a Task Program.",
      "boundaries": [
        "Configuration describes intent; it does not itself execute the simulation."
      ],
      "evidence": [
        {
          "path": "embodichain/lab/task_program/language/schema.py",
          "symbol": "TaskProgramCfg",
          "start_line": 725,
          "end_line": 725,
          "excerpt": "class TaskProgramCfg:"
        }
      ],
      "documentation": [
        {
          "docname": "api_reference/embodichain/embodichain.lab.task_program.language",
          "label": "TaskProgramCfg documentation"
        }
      ]
    },
    {
      "id": "program-compiler",
      "label": "TaskProgramCompiler",
      "kind": "class",
      "topic_ids": [
        "task-programs"
      ],
      "summary": "Compile a validated program against a provider-free scene manifest.",
      "boundaries": [
        "Program compilation must not be presented as live Semantic Call grounding."
      ],
      "evidence": [
        {
          "path": "embodichain/lab/task_program/compiler/program.py",
          "symbol": "TaskProgramCompiler",
          "start_line": 1179,
          "end_line": 1179,
          "excerpt": "class TaskProgramCompiler:"
        }
      ],
      "documentation": [
        {
          "docname": "api_reference/embodichain/embodichain.lab.task_program.compiler",
          "label": "TaskProgramCompiler documentation"
        }
      ]
    },
    {
      "id": "compiled-program",
      "label": "CompiledTaskProgram",
      "kind": "class",
      "topic_ids": [
        "task-programs"
      ],
      "summary": "Immutable, lazily expanded program and analysis surface.",
      "boundaries": [
        "A compiled program is not a controller command or proof of physical success."
      ],
      "evidence": [
        {
          "path": "embodichain/lab/task_program/compiler/program.py",
          "symbol": "CompiledTaskProgram",
          "start_line": 962,
          "end_line": 962,
          "excerpt": "class CompiledTaskProgram:"
        }
      ],
      "documentation": [
        {
          "docname": "api_reference/embodichain/embodichain.lab.task_program.compiler",
          "label": "CompiledTaskProgram documentation"
        }
      ]
    },
    {
      "id": "environment-adapter",
      "label": "TaskProgramEnvironmentAdapter",
      "kind": "class",
      "topic_ids": [
        "task-programs"
      ],
      "summary": "Validate integration selection and assemble the runtime and Gym bridge.",
      "boundaries": [
        "Live provider choices are supplied by the environment factory."
      ],
      "evidence": [
        {
          "path": "embodichain/lab/task_program/integrations/environment.py",
          "symbol": "TaskProgramEnvironmentAdapter",
          "start_line": 295,
          "end_line": 295,
          "excerpt": "class TaskProgramEnvironmentAdapter:"
        }
      ],
      "documentation": [
        {
          "docname": "api_reference/embodichain/embodichain.lab.task_program.integrations",
          "label": "TaskProgramEnvironmentAdapter documentation"
        }
      ]
    },
    {
      "id": "simulation-factory",
      "label": "SimulationTaskProgramFactory",
      "kind": "class",
      "topic_ids": [
        "task-programs"
      ],
      "summary": "Supply simulation-bound providers and construct an engine around the selected robot and planner.",
      "boundaries": [
        "This is the simulation-specific factory, not the provider-free program compiler."
      ],
      "evidence": [
        {
          "path": "embodichain/lab/task_program/integrations/simulation/environment.py",
          "symbol": "SimulationTaskProgramFactory",
          "start_line": 407,
          "end_line": 407,
          "excerpt": "class SimulationTaskProgramFactory(TaskProgramEnvironmentFactory):"
        }
      ],
      "documentation": [
        {
          "docname": "api_reference/embodichain/embodichain.lab.task_program.integrations.simulation",
          "label": "Simulation integration API"
        }
      ]
    },
    {
      "id": "semantic-compiler",
      "label": "SemanticCallCompiler",
      "kind": "class",
      "topic_ids": [
        "task-programs"
      ],
      "summary": "Analyze and ground Semantic Calls against their bound integration.",
      "boundaries": [
        "Keep live grounding distinct from static TaskProgramCompiler compilation."
      ],
      "evidence": [
        {
          "path": "embodichain/lab/task_program/compiler/lowering.py",
          "symbol": "SemanticCallCompiler",
          "start_line": 767,
          "end_line": 767,
          "excerpt": "class SemanticCallCompiler:"
        }
      ],
      "documentation": [
        {
          "docname": "api_reference/embodichain/embodichain.lab.task_program.compiler",
          "label": "SemanticCallCompiler documentation"
        }
      ]
    },
    {
      "id": "semantic-executor",
      "label": "SemanticCallExecutor",
      "kind": "class",
      "topic_ids": [
        "task-programs"
      ],
      "summary": "Ground and execute Semantic Calls using one runner per call.",
      "boundaries": [
        "Execution sessions do not cross call barriers."
      ],
      "evidence": [
        {
          "path": "embodichain/lab/task_program/runtime/executor.py",
          "symbol": "SemanticCallExecutor",
          "start_line": 216,
          "end_line": 216,
          "excerpt": "class SemanticCallExecutor:"
        }
      ],
      "documentation": [
        {
          "docname": "api_reference/embodichain/embodichain.lab.task_program.runtime",
          "label": "SemanticCallExecutor documentation"
        }
      ]
    },
    {
      "id": "atomic-engine",
      "label": "AtomicActionEngine",
      "kind": "class",
      "topic_ids": [
        "atomic-actions"
      ],
      "summary": "Own planning resources and coordinate atomic-action planning and sessions.",
      "boundaries": [
        "Command dispatch belongs to execution runners and their sinks."
      ],
      "evidence": [
        {
          "path": "embodichain/lab/sim/atomic_actions/engine.py",
          "symbol": "AtomicActionEngine",
          "start_line": 45,
          "end_line": 45,
          "excerpt": "class AtomicActionEngine:"
        }
      ],
      "documentation": [
        {
          "docname": "api_reference/embodichain/embodichain.lab.sim.atomic_actions",
          "label": "AtomicActionEngine documentation"
        }
      ]
    },
    {
      "id": "motion-generator",
      "label": "MotionGenerator",
      "kind": "class",
      "topic_ids": [
        "motion-planning"
      ],
      "summary": "Compose planner backends for robot motion generation.",
      "boundaries": [
        "The motion generator is owned by the motion module; planners do not re-export it."
      ],
      "evidence": [
        {
          "path": "embodichain/lab/sim/motion/motion_generator.py",
          "symbol": "MotionGenerator",
          "start_line": 191,
          "end_line": 191,
          "excerpt": "class MotionGenerator:"
        }
      ],
      "documentation": [
        {
          "docname": "api_reference/embodichain/embodichain.lab.sim.motion.motion_generator",
          "label": "MotionGenerator documentation"
        }
      ]
    },
    {
      "id": "execution-runner",
      "label": "ExecutionRunner",
      "kind": "class",
      "topic_ids": [
        "atomic-actions"
      ],
      "summary": "Advance an execution session using observation, command, and clock ports.",
      "boundaries": [
        "A sink acknowledgement is not automatically a completed physical transition."
      ],
      "evidence": [
        {
          "path": "embodichain/lab/sim/atomic_actions/runner.py",
          "symbol": "ExecutionRunner",
          "start_line": 335,
          "end_line": 335,
          "excerpt": "class ExecutionRunner:"
        }
      ],
      "documentation": [
        {
          "docname": "api_reference/embodichain/embodichain.lab.sim.atomic_actions",
          "label": "ExecutionRunner documentation"
        }
      ]
    },
    {
      "id": "gym-bridge",
      "label": "TaskProgramDemoBridge",
      "kind": "class",
      "topic_ids": [
        "task-programs"
      ],
      "summary": "Adapt program segments to lazy Gym demonstrations with shared runtime, sink, and clock.",
      "boundaries": [
        "The sample shows sequential execution; parallel scheduling and recovery are not exhaustively represented."
      ],
      "evidence": [
        {
          "path": "embodichain/lab/gym/envs/task_program/bridge.py",
          "symbol": "TaskProgramDemoBridge",
          "start_line": 951,
          "end_line": 951,
          "excerpt": "class TaskProgramDemoBridge:"
        }
      ],
      "documentation": [
        {
          "docname": "api_reference/embodichain/embodichain.lab.gym.envs.task_program",
          "label": "TaskProgramDemoBridge documentation"
        }
      ]